{
  "$schema": "./kineto.features.schema.json",
  "contractVersion": "1.3.0",
  "libraryVersion": "0.8.33",
  "moduleCount": 43,
  "modules": [
    {
      "name": "ambientMedia",
      "attribute": "data-kt-ambient-media",
      "defaultVariant": "image-clone",
      "variants": [
        "image-clone",
        "video-sample",
        "color"
      ],
      "publicOptions": [
        "allowOverflow",
        "ambientSrc",
        "ambientSrcset",
        "blur",
        "brightness",
        "color",
        "fallbackColor",
        "hideOnPause",
        "inset",
        "opacity",
        "radius",
        "sampleFps",
        "sampleHeight",
        "sampleWidth",
        "saturation",
        "scale",
        "source",
        "src"
      ]
    },
    {
      "name": "blurText",
      "attribute": "data-kt-blur-text",
      "defaultVariant": "blur",
      "variants": [
        "blur"
      ],
      "publicOptions": [
        "duration",
        "ease",
        "onComplete",
        "once",
        "stagger",
        "start"
      ]
    },
    {
      "name": "brushReveal",
      "attribute": "data-kt-brush-reveal",
      "defaultVariant": "brush",
      "variants": [
        "brush"
      ],
      "publicOptions": [
        "blur",
        "crossOrigin",
        "fade",
        "maxDpr",
        "onError",
        "opacity",
        "persist",
        "radius",
        "revealSrc",
        "softness",
        "src"
      ]
    },
    {
      "name": "cardGlow",
      "attribute": "data-kt-card-glow",
      "defaultVariant": "spotlight",
      "variants": [
        "spotlight",
        "pointer",
        "border",
        "comet",
        "aurora",
        "shine"
      ],
      "publicOptions": [
        "alwaysOn",
        "blendMode",
        "blur",
        "borderBlur",
        "borderColor",
        "borderColor2",
        "borderGlow",
        "borderInset",
        "borderOpacity",
        "borderRadius",
        "borderWidth",
        "color",
        "color1",
        "color2",
        "cycleDuration",
        "disableOnMobile",
        "duration",
        "ease",
        "follow",
        "halo",
        "intensity",
        "luminousBorder",
        "mode",
        "opacity",
        "preset",
        "radius",
        "reflection",
        "sensitivity",
        "smoothing",
        "speed",
        "spread",
        "surface",
        "surfaceBlend",
        "surfaceBlur",
        "surfaceColor",
        "surfaceColor2",
        "surfaceGradient",
        "surfaceInset",
        "surfaceOpacity",
        "surfaceSize"
      ]
    },
    {
      "name": "counter",
      "attribute": "data-kt-counter",
      "defaultVariant": "slot",
      "variants": [
        "slot",
        "plain",
        "digit",
        "pop",
        "flip",
        "clock"
      ],
      "publicOptions": [
        "bareBackground",
        "blink",
        "blinkSeparators",
        "clockSeparator",
        "clockStyle",
        "comma",
        "daysLabel",
        "decimals",
        "delay",
        "duration",
        "ease",
        "format",
        "from",
        "gap",
        "grouping",
        "hour12",
        "lineHeight",
        "locale",
        "loops",
        "mode",
        "onComplete",
        "once",
        "popAlign",
        "popDuration",
        "popScale",
        "prefix",
        "preset",
        "rollDirection",
        "rollDuration",
        "seamColor",
        "seconds",
        "separator",
        "separatorColor",
        "shadow",
        "showDays",
        "since",
        "stagger",
        "start",
        "style",
        "suffix",
        "tile",
        "tileColor",
        "tileRadius",
        "tileTextColor",
        "to",
        "until"
      ]
    },
    {
      "name": "cssScroll",
      "attribute": "data-kt-css-scroll",
      "defaultVariant": "progress-property",
      "variants": [
        "progress-property",
        "css-animation-timeline"
      ],
      "publicOptions": [
        "cssAnimation",
        "end",
        "onUpdate",
        "property",
        "rangeEnd",
        "rangeStart",
        "start"
      ]
    },
    {
      "name": "cursor",
      "attribute": "data-kt-cursor",
      "defaultVariant": "dot",
      "variants": [
        "dot",
        "ring",
        "blob",
        "crosshair",
        "text",
        "trail",
        "orbit",
        "snake",
        "sparkle",
        "image",
        "custom"
      ],
      "publicOptions": [
        "backdropFilter",
        "background",
        "blur",
        "borderColor",
        "borderWidth",
        "className",
        "clickImage",
        "clickImageDuration",
        "clickImageSize",
        "clickSprite",
        "clickSpriteDuration",
        "clickSpriteFrames",
        "clickSpriteHeight",
        "clickSpriteWidth",
        "color",
        "crosshairSize",
        "dot",
        "dotColor",
        "dotSize",
        "ease",
        "follower",
        "followerSize",
        "full",
        "global",
        "height",
        "hiddenSelector",
        "hideDotOnHover",
        "hoverBackground",
        "hoverClass",
        "hoverColor",
        "hoverDotOpacity",
        "hoverDotSize",
        "hoverEffect",
        "hoverLabel",
        "hoverScale",
        "hoverSelector",
        "hoverSrc",
        "hoverTemplate",
        "html",
        "label",
        "labelColor",
        "labelSize",
        "mixBlendMode",
        "onEnter",
        "onLeave",
        "opacity",
        "orbitHoverScale",
        "orbitRadius",
        "orbitSpeed",
        "orbitSquash",
        "orbitText",
        "preset",
        "pressScale",
        "radius",
        "rotate",
        "rotateDuration",
        "rotateText",
        "shadow",
        "shape",
        "smoothing",
        "snakeGap",
        "snakeMinScale",
        "snakeScaleEase",
        "snakeText",
        "sparkleColor",
        "sparkleColor2",
        "sparkleDuration",
        "sparkleSize",
        "sparkleSymbols",
        "sparkleThrottle",
        "speed",
        "spring",
        "src",
        "template",
        "text",
        "textColor",
        "trailColor",
        "trailCount",
        "trailSize",
        "type",
        "width",
        "zIndex"
      ]
    },
    {
      "name": "fullpage",
      "publicOptions": [
        "autoAdvance",
        "axis",
        "dots",
        "drag",
        "duration",
        "ease",
        "height",
        "initial",
        "keyboard",
        "loop",
        "mode",
        "onChange",
        "onLeave",
        "sectionSelector",
        "threshold",
        "touch",
        "wheel"
      ],
      "attribute": "data-kt-fullpage",
      "defaultVariant": "transform",
      "variants": [
        "transform",
        "snap"
      ]
    },
    {
      "name": "glitch",
      "attribute": "data-kt-glitch",
      "defaultVariant": "rgb",
      "variants": [
        "rgb",
        "noise",
        "crt",
        "digital",
        "image",
        "vcr"
      ],
      "publicOptions": [
        "blendMode",
        "colors",
        "delay",
        "duration",
        "intensity",
        "loop",
        "preset",
        "sliceCount",
        "speed",
        "trigger",
        "type"
      ]
    },
    {
      "name": "lazy",
      "attribute": "data-kt-lazy",
      "defaultVariant": "fade",
      "variants": [
        "fade",
        "blur-up",
        "skeleton",
        "pixelate",
        "print",
        "dissolve",
        "flicker",
        "polaroid"
      ],
      "publicOptions": [
        "animated",
        "aspectRatio",
        "blur",
        "crossOrigin",
        "delay",
        "direction",
        "display",
        "duration",
        "ease",
        "edgeOpacity",
        "edgeWidth",
        "effect",
        "fadeDuration",
        "fallbackSrc",
        "feather",
        "flickerBackground",
        "frame",
        "frameColor",
        "glitchStrength",
        "height",
        "holdDuration",
        "keepFrame",
        "maxDpr",
        "minDuration",
        "nativeLazy",
        "noise",
        "noiseBlend",
        "noiseContrast",
        "noiseFps",
        "noiseHeight",
        "noiseWidth",
        "objectFit",
        "objectPosition",
        "onError",
        "onLoad",
        "onProgress",
        "pixelEnd",
        "pixelStart",
        "pixelStepCount",
        "preset",
        "renderFps",
        "rootMargin",
        "rotate",
        "sizes",
        "skeletonAngle",
        "skeletonColor",
        "skeletonHighlight",
        "skeletonIcon",
        "skeletonSpeed",
        "skeletonVariant",
        "sliceCount",
        "src",
        "srcset",
        "startScale",
        "stepCount",
        "stepDuration",
        "steps",
        "threshold",
        "variant"
      ]
    },
    {
      "name": "lightbox",
      "attribute": "data-kt-lightbox",
      "defaultVariant": "viewer",
      "variants": [
        "viewer",
        "grouped"
      ],
      "publicOptions": [
        "alt",
        "backdropBlur",
        "backdropColor",
        "backdropOpacity",
        "caption",
        "className",
        "closeOnBackdrop",
        "cursor",
        "description",
        "doubleClickZoom",
        "duration",
        "exif",
        "group",
        "info",
        "lazyEffect",
        "lazyOptions",
        "lightboxDuration",
        "maxZoom",
        "metadata",
        "minZoom",
        "minimap",
        "onChange",
        "onClose",
        "onLoad",
        "onOpen",
        "radius",
        "renderUI",
        "share",
        "src",
        "title",
        "toolbar",
        "transition",
        "uiTemplate",
        "wheelStep",
        "zoom",
        "zoomStep"
      ]
    },
    {
      "name": "loader",
      "attribute": "data-kt-loader",
      "defaultVariant": "bar",
      "variants": [
        "slot",
        "circular",
        "bar"
      ],
      "publicOptions": [